Year,Quarter,LocationDesc,HealthTopic,PolicyTopic,Setting,Title,PolicyTypeID,PolicyTopicID
2003,1,Arkansas,Physical Activity,Task Forces/Councils,School/After School,Child Health Advisory Committee,LEG,047TFC
2011,1,Mississippi,Nutrition,Disparities/Equity,Restaurant/Retail,Nonprofit Organizations Sales Tax,LEG,013DEQ
2011,1,Missouri,Nutrition,Farmers Markets,Community,Sewer Service Lines Failure Repair Fee,LEG,016FAM
2005,1,Massachusetts,Nutrition,Medical Care,Community,Environmental Trust,LEG,026MEC
2010,1,District of Columbia,Nutrition,Appropriations,Medical and/or Hospital,Hospital and Medical Services Corporation,LEG,002APP
2012,1,Mississippi,Nutrition,Farmers Markets,Community,An Act Concerning Farmers' Markets<br>,LEG,016FAM
2011,1,Pennsylvania,Physical Activity,Incentives,Work Place,Healthy Living Committee Discount,LEG,029INC
2010,1,California,Obesity,Front of Package Labeling,Community,Education: Physical Education,LEG,024FOP
2011,1,Connecticut,Obesity,Food Restrictions,Community,Locally Grown Products by Residents,LEG,020FOR
2011,1,Hawaii,Nutrition,Food Assistance Programs,Community,Health,LEG,003FAP
2013,2,New York,Nutrition,Farmers Markets,Community,An Act to Amend the Agriculture and Markets Law,LEG,016FAM
2011,1,Georgia,Obesity,Food Restrictions,School/After School,Georgia Grown Farm Products,LEG,020FOR
2011,1,New York,Physical Activity,Pedestrians/Walking,Community,Blighted Properties,LEG,052PED
2011,1,Hawaii,Obesity,Appropriations,Community,Food and Medical Services,LEG,002APP
2011,1,Hawaii,Obesity,Food Restrictions,Community,Support for Home Organic Produce Cooperatives,LEG,020FOR
2011,1,Hawaii,Nutrition,Access to Healthy Foods,Community,Appropriation for the Women and Infant Children Farmers,LEG,001AHF
2003,1,Illinois,Nutrition,Incentives,School/After School,Obesity,LEG,029INC
2012,1,Kansas,Obesity,Initiatives and Programs,Community,Resolution,LEG,053INP
2009,1,Vermont,Nutrition,Access to Healthy Foods,Community,Economic Development,LEG,001AHF
2009,1,New York,Nutrition,Liability and Indemnity,School/After School,Governor's Council on Physical Fitness,LEG,030LAI
2011,1,Idaho,Obesity,Appropriations,Community,Urban Renewal,LEG,002APP
2009,1,Maryland,Physical Activity,Pedestrians/Walking,Community,Quiet Vehicles and Pedestrian Safety,LEG,052PED
2008,1,Michigan,Nutrition,Incentives,Community,House Resolution,LEG,029INC
2009,1,California,Nutrition,Agriculture and Farming,Restaurant/Retail,Public Health: Food Justice,LEG,017AGF
2011,1,Indiana,Nutrition,Agriculture and Farming,Restaurant/Retail,Farm Wineries and Direct Wine Sellers,LEG,017AGF
2009,1,Vermont,Nutrition,Appropriations,Community,Snack Food,LEG,002APP
2010,1,Iowa,Nutrition,Farm Direct Foods,Community,Persons Who Operate Dairy Farms,LEG,015FDF
2011,1,Kentucky,Obesity,Liability and Indemnity,Work Place,State Employee Health Insurance,LEG,030LAI
2011,1,New York,Obesity,Appropriations,Community,Parking in a Bicycle Lane,LEG,002APP
2013,1,Idaho,Nutrition,Initiatives and Programs,Medical and/or Hospital,Medicaid Basic Plan Benefit,REG,053INP
2005,1,Florida,Physical Activity,Bicycling,Community,Greenways and Trails,LEG,005BIK
2009,1,Massachusetts,Nutrition,Farm Direct Foods,Community,Food Policy Council,LEG,015FDF
2009,1,Minnesota,Physical Activity,Safe Routes to Schools,Community,Capital Improvements,LEG,041SRS
2005,1,West Virginia,Nutrition,Food Assistance Programs,Community,An Act Making Appropriations,LEG,003FAP
2011,1,Texas,Obesity,Food Restrictions,Community,Midlothian Municipal Management District No. 2,LEG,020FOR
2011,1,Nevada,Physical Activity,School Siting,Community,Redevelopment Agencies,LEG,042SIT
2005,1,California,Physical Activity,Initiatives and Programs,Work Place,Senate Concurrent  Resolution,LEG,053INP
2003,1,Oregon,Nutrition,Farmers Markets,Community,An Act Making Appropriations<br>,LEG,016FAM
2004,1,Mississippi,Nutrition,Appropriations,Community,An Act Making Appropriations<br>,LEG,002APP
2011,1,Missouri,Nutrition,Farmers Markets,Restaurant/Retail,County Water Supply Lake Authority,LEG,016FAM
2009,1,Massachusetts,Nutrition,Agriculture and Farming,School/After School,Promoting Better Health in Public Schools,LEG,017AGF
2011,1,Massachusetts,Nutrition,Appropriations,Community,Liability of Farmer Markets,LEG,002APP
2009,1,California,Obesity,Food Restrictions,Community,Agriculture: Victory Garden Growers,LEG,020FOR
2005,1,Maryland,Obesity,Appropriations,School/After School,Health and Nutrition in Public Schools,LEG,002APP
2010,1,Illinois,Nutrition,Task Forces/Councils,Medical and/or Hospital,Chronic Disease Nutrition and Outcomes Commission,LEG,047TFC
2010,1,South Carolina,Nutrition,Agriculture and Farming,Restaurant/Retail,Litigation Settlement,LEG,017AGF
2009,1,Massachusetts,Physical Activity,Physical Education Requirements,School/After School,Local School Health Advisory Councils,LEG,036PER
2011,1,Tennessee,Nutrition,Appropriations,Community,Taxes,LEG,002APP
2003,1,Wyoming,Nutrition,Breastfeeding,Community,House Joint Resolution  <br>,LEG,007BFD
2011,1,West Virginia,Nutrition,Incentives,Restaurant/Retail,Food Tax Increasing the Tax on Nonintoxicating Beer,LEG,029INC
2011,1,Minnesota,Physical Activity,Incentives,Community,Stadiums,LEG,029INC
2011,1,Arizona,Nutrition,Appropriations,Community,Tax on Sweetened Beverages,LEG,002APP
2009,1,Illinois,Nutrition,Appropriations,Community,Department pf Human Services Appropriations,LEG,002APP
2005,1,North Dakota,Obesity,Appropriations,Community,Foster Care Licensing,LEG,002APP
2010,1,Maryland,Obesity,Portion Size,Restaurant/Retail,Public Health,LEG,038POS
2010,1,Virginia,Nutrition,Medical Care,Community,Following Too Closely,LEG,026MEC
2011,1,Mississippi,Obesity,Health Insurance Coverage,Medical and/or Hospital,Medicaid Amendments,LEG,028HIC
2011,1,Nebraska,Nutrition,Disparities/Equity,Restaurant/Retail,Children's Health,LEG,013DEQ
2011,1,Oregon,Nutrition,Farm Direct Foods,Community,Uses on Lands Zoned for Exclusive Farm Use,LEG,015FDF
2011,1,Mississippi,Obesity,Disparities/Equity,School/After School,Body Mass Index,LEG,013DEQ
2010,1,New Mexico,Nutrition,Appropriations,Community,Taxation and Soft Drinks,LEG,002APP
2009,1,Minnesota,Physical Activity,Bicycling,School/After School,Capital Improvements,LEG,005BIK
2009,1,South Carolina,Nutrition,Trans Fats,School/After School,Nutrition Standards for Elementary Schools,REG,050FAT
2010,1,Massachusetts,Nutrition,Agriculture and Farming,School/After School,School Nutrition,LEG,017AGF
2001,1,Alabama,Nutrition,Agriculture and Farming,Community,To Make Appropriations <br>,LEG,017AGF
2011,1,Vermont,Nutrition,Farm Direct Foods,School/After School,Economic Development,LEG,015FDF
2011,1,Pennsylvania,Nutrition,Appropriations,Work Place,Workplace Accommodations For Nursing Mothers Act,LEG,002APP
2007,1,Texas,Nutrition,Task Forces/Councils,School/After School,Diabetes Risk Assessment Program,LEG,047TFC
2009,1,Massachusetts,Nutrition,Farm Direct Foods,Restaurant/Retail,Farmers Markets,LEG,015FDF
2011,1,Massachusetts,Nutrition,Initiatives and Programs,Community,An Act Making Appropriations<br>,LEG,053INP
2005,1,Michigan,Nutrition,Medical Care,Community,Bicyclist Rights,LEG,026MEC
2009,1,District of Columbia,Physical Activity,Built Environment and Street-Scale Design,Community,Pedestrian Advisory Council,LEG,049BED
2011,1,Maine,Nutrition,Access to Healthy Foods,Community,Food Licensing Requirements,LEG,001AHF
2011,1,Hawaii,Obesity,Appropriations,Community,Improvements for the Benefit of the 4th District,LEG,002APP
2010,1,Utah,Nutrition,Farm Direct Foods,Community,Agricultural Advisory Board,LEG,015FDF
2011,1,New York,Nutrition,Access to Healthy Foods,Community,Establishing a Community Garden Task Force<br>,LEG,001AHF
2015,1,Colorado,Nutrition,Appropriations,School/After School,Farm to School Grant Program,LEG,002APP
2012,1,Michigan,Nutrition,Initiatives and Programs,School/After School,An Act Concerning Appropriations<br>,LEG,053INP
2011,1,Vermont,Nutrition,Food Assistance Programs,Community,Federal Supplemental Nutrition Assistance Program,LEG,003FAP
2010,1,Georgia,Physical Activity,Bicycling,Community,Driving on the Right Side of the Roadway,LEG,005BIK
2011,1,Mississippi,Obesity,Task Forces/Councils,Restaurant/Retail,Sweetened Beverages and Syrups Tax,LEG,047TFC
2009,1,Washington,Obesity,Front of Package Labeling,Restaurant/Retail,Trans Fat,LEG,024FOP
2010,1,Wisconsin,Obesity,Menu Labeling,Restaurant/Retail,Nutritional Information,LEG,032MNL
2010,1,Illinois,Physical Activity,Built Environment and Street-Scale Design,Community,Night Preservation,LEG,049BED
2010,1,Colorado,Nutrition,Access to Healthy Foods,Restaurant/Retail,Food Systems Advisory Council,LEG,001AHF
2010,1,Florida,Nutrition,School Nutrition,School/After School,School Food Service Programs,LEG,043SNU
2009,1,Missouri,Nutrition,Appropriations,Community,Agriculture and Local Foods,LEG,002APP
2010,1,Maine,Obesity,Appropriations,Community,Maine Food Processing Grant Program,REG,002APP
2009,1,Michigan,Obesity,Body Mass Index (BMI),Community,Development Projects,LEG,006BMI
2012,1,New York,Physical Activity,Physical Education Requirements,Restaurant/Retail,Relates to Obesity Prevention<br>,LEG,036PER
2012,1,New Jersey,Physical Activity,Initiatives and Programs,Medical and/or Hospital,An Act Reorganizing and Renaming the Department of Health and Senior Services as the Department of Health<br>,LEG,053INP
2011,1,Mississippi,Nutrition,Incentives,Community,Healthy Foods,LEG,029INC
2011,1,Mississippi,Physical Activity,Safe Routes to Schools,School/After School,Sweetened Beverages and Syrups Tax,LEG,041SRS
2011,1,Minnesota,Obesity,Appropriations,Community,Health,LEG,002APP
2009,1,Minnesota,Obesity,Menu Labeling,Community,Human Services,LEG,032MNL
2011,1,New York,Obesity,Appropriations,Restaurant/Retail,Senior Benefits Card Program,LEG,002APP
2009,1,Hawaii,Obesity,Appropriations,School/After School,School Impact Fees,LEG,002APP
2009,1,Massachusetts,Nutrition,Medical Care,School/After School,Transportation System Modernization,LEG,026MEC
2002,1,Virginia,Obesity,Appropriations,Community,VDOT Pedestrian Projects,LEG,002APP
2011,1,Hawaii,Nutrition,Fruits and Vegetables,Restaurant/Retail,Home Organic Produce Cooperatives,LEG,025FAV
2013,1,Delaware,Nutrition,Breastfeeding,Community,In Support of Nutrition Education and Outreach for Moms and Babies,LEG,007BFD
2002,1,South Carolina,Physical Activity,Bicycling,Community,An Act Relating to Motor Vehicle Registering and Licensing<br>,LEG,005BIK
2011,1,Massachusetts,Obesity,Appropriations,Community,Motor Scooter Safety Helmets,LEG,002APP
2009,1,Mississippi,Nutrition,Appropriations,Community,Sales Tax,LEG,002APP
2010,1,Oklahoma,Nutrition,Incentives,Restaurant/Retail,Healthy Foods,LEG,029INC
2011,1,New York,Nutrition,Food Assistance Programs,Work Place,Cooperative Agreements for Personnel Services,LEG,003FAP
2003,1,North Carolina,Obesity,Task Forces/Councils,Community,Highway Trust Fund Study Committee,LEG,047TFC
2011,1,Hawaii,Nutrition,Farm Direct Foods,School/After School,School Gardens,LEG,015FDF
2010,1,California,Physical Activity,Physical Activity Requirements,Community,Education: Physical Education,LEG,035PAR
2009,1,Texas,Physical Activity,Pedestrians/Walking,Community,Specialty License Plates,LEG,052PED
2009,1,Massachusetts,Nutrition,Agriculture and Farming,Community,Public Contracting With Massachusetts Farmers,LEG,017AGF
2009,1,New York,Obesity,Appropriations,School/After School,New York City School Construction,LEG,002APP
2010,1,California,Obesity,Appropriations,School/After School,Budget Act of 2010,LEG,002APP
2012,1,Mississippi,Obesity,Health Insurance Coverage,Community,Requirements for Medicare Beneficiaries<br>,LEG,028HIC
2011,1,Louisiana,Obesity,Front of Package Labeling,School/After School,Schools,LEG,024FOP
2009,1,Tennessee,Nutrition,Agriculture and Farming,Community,Food and Food Products,LEG,017AGF
2010,1,Minnesota,Obesity,Menu Labeling,Community,Capital Improvements,LEG,032MNL
2013,1,Mississippi,Physical Activity,Initiatives and Programs,Community,An Act to Create the Sweetened Beverages and Syrups Tax Law,LEG,053INP
2013,1,Texas,Nutrition,Disparities/Equity,Community,An Act Relating to the Establishment of a Community Development Grocery Store Revolving Loan Fund Program,LEG,013DEQ
2010,1,North Carolina,Nutrition,School Nutrition,School/After School,State Board of Education,LEG,043SNU
2011,1,Massachusetts,Physical Activity,Access to Recreational Opportunities,Community,Public Access to State Funded School Buildings,LEG,004ARO
2005,1,Illinois,Physical Activity,"Parks, Recreation and Trails",Community,Park Zone Speed Limits,LEG,034PRT
2010,1,Michigan,Obesity,Body Mass Index (BMI),Community,Next Michigan Development Areas,LEG,006BMI
2009,1,Colorado,Nutrition,Fruits and Vegetables,Community,Reauthorize Child Nutrition Act,LEG,025FAV
2010,1,District of Columbia,Obesity,Appropriations,Community,H Street Disposition Approval Resolution,LEG,002APP
2011,1,Texas,Obesity,Liability and Indemnity,Community,Sweetened Beverages Tax,LEG,030LAI
2009,1,Massachusetts,Physical Activity,Disabilities,Community,Healthy Transportation Planning,LEG,011DIS
2009,1,New Jersey,Obesity,Menu Labeling,Community,Smart Housing Incentive Act,LEG,032MNL
2009,1,Hawaii,Physical Activity,Safe Routes to Schools,School/After School,School Traffic Safety,LEG,041SRS
2011,1,Illinois,Obesity,Appropriations,Restaurant/Retail,Home Rule County Soft Drink Retailers' Occupation Tax,LEG,002APP
2011,1,Mississippi,Nutrition,Incentives,School/After School,Task Force on Combating Childhood Obesity,LEG,029INC
2011,1,Mississippi,Nutrition,Food Assistance Programs,Restaurant/Retail,Exercise Equipment Retail Sales Tax,LEG,003FAP
2011,1,New Hampshire,Nutrition,Farm Direct Foods,Restaurant/Retail,Definition of Local,LEG,015FDF
2011,1,Montana,Nutrition,Farm Direct Foods,Restaurant/Retail,Appropriations by Budget Amendment,LEG,015FDF
2007,1,Rhode Island,Obesity,Food Restrictions,School/After School,Healthier High School Vending Machines,LEG,020FOR
2010,1,Arizona,Physical Activity,Bicycling,Community,Bicycles,LEG,005BIK
2011,1,Hawaii,Nutrition,Agriculture and Farming,Restaurant/Retail,Agriculture,LEG,017AGF
2005,1,California,Nutrition,Farm Direct Foods,Community,Farmers' Markets,LEG,015FDF
2002,1,Maryland,Nutrition,Point of Purchase Promotion,Community,Electronic Personal Assistive Mobility Devices,LEG,037POP
2011,1,Hawaii,Physical Activity,Pedestrians/Walking,Medical and/or Hospital,Tax Credits,LEG,052PED
2011,1,New Hampshire,Obesity,Health Insurance Coverage,Community,Choices for Independence Program<br>,REG,028HIC
2011,1,Texas,Obesity,Appropriations,School/After School,Physical Fitness of Public School Students Assessment,LEG,002APP
2010,1,Tennessee,Nutrition,Appropriations,School/After School,Education,LEG,002APP
2011,1,Massachusetts,Nutrition,Farm Direct Foods,Community,Foods Containing Artificial Trans Fat,LEG,015FDF
2011,1,Alaska,Physical Activity,"Parks, Recreation and Trails",Community,Appropriations,LEG,034PRT
2011,1,Montana,Nutrition,Food Assistance Programs,Community,Recommendations on Reducing Childhood Hunger,LEG,003FAP
2010,1,Wisconsin,Nutrition,Farm Direct Foods,Community,Food Produced in This State,LEG,015FDF
2007,1,Wisconsin,Obesity,Initiatives and Programs,Community,Various Amendments,LEG,053INP
2011,1,Massachusetts,Obesity,Disparities/Equity,Restaurant/Retail,Environmental and Health Impact Reports,LEG,013DEQ
2009,1,Ohio,Nutrition,Farm Direct Foods,Community,Livestock Care Standards Board,LEG,015FDF
2010,1,District of Columbia,Nutrition,Liability and Indemnity,Community,Fiscal Year 2011 Balanced Budget Support Emergency Act,LEG,030LAI
2010,1,Georgia,Nutrition,Agriculture and Farming,Community,Intrastate Commerce,LEG,017AGF
2011,1,Oregon,Nutrition,Food Assistance Programs,Restaurant/Retail,Nutrition,LEG,003FAP
2011,1,California,Obesity,Body Mass Index (BMI),Community,Transportation Funds: Capital Improvement Projects,LEG,006BMI
2011,1,Texas,Physical Activity,Physical Activity Requirements,Community,Sweetened Beverages Tax,LEG,035PAR
2011,1,Missouri,Obesity,Body Mass Index (BMI),Community,Streamlined Sales and Use Tax Agreement,LEG,006BMI
2009,1,Rhode Island,Nutrition,Food Security,Restaurant/Retail,Food and Drugs,LEG,023FOS
2009,1,Massachusetts,Nutrition,Fruits and Vegetables,Community,Public Contracting With Massachusetts Farmers,LEG,025FAV
2009,1,Massachusetts,Physical Activity,Public Transportation,Community,Land Use and Community Housing Development,LEG,040TRS
2010,1,Oklahoma,Nutrition,Nutrition Standards,Community,"My Life, My Choice Waiver",REG,010NUS
2009,1,Vermont,Nutrition,Fruits and Vegetables,School/After School,Farmers Markets,LEG,025FAV
2011,1,Hawaii,Nutrition,Incentives,Medical and/or Hospital,Tax Credits,LEG,029INC
2011,1,Oregon,Nutrition,Nutrition Standards,Community,Minimal Nutritional Value,LEG,010NUS
2010,1,Rhode Island,Physical Activity,Bicycling,Community,Courts and Civil Procedure,LEG,005BIK
2009,1,New York,Obesity,Appropriations,School/After School,Education Department to Make Annual Report,LEG,002APP
2009,1,Texas,Nutrition,Breastfeeding,Work Place,Breast Feeding,LEG,007BFD
2011,1,Minnesota,Physical Activity,"Parks, Recreation and Trails",Community,Taxation,LEG,034PRT
2009,1,Pennsylvania,Obesity,Menu Labeling,Restaurant/Retail,Restaurant Dietary Information Requirement,LEG,032MNL
2011,1,Maine,Nutrition,Farm Direct Foods,Community,Farmers Markets and Electronic Fund Transfer,LEG,015FDF
2009,1,Connecticut,Nutrition,Food Security,Restaurant/Retail,Health and Nutritional Information in Restaurants,LEG,023FOS
2014,4,New Jersey,Nutrition,Disparities/Equity,Community,Children’s Health Promotion Fund,LEG,013DEQ
2008,1,New York,Nutrition,Access to Healthy Foods,Community,Health and  Mental Hygiene Budget<br>,LEG,001AHF
2009,1,New Hampshire,Obesity,Food Restrictions,Community,Weights and Measurements at Farmers Markets,LEG,020FOR
2010,1,Iowa,Nutrition,Farm Direct Foods,Community,Local Farmer and Food Security Income Tax Credit,LEG,015FDF
2011,1,Massachusetts,Obesity,Body Mass Index (BMI),Community,Smart Growth Zoning and Housing Production,LEG,006BMI
2004,1,California,Nutrition,Initiatives and Programs,Community,Assembly Concurrent Resolution,LEG,053INP
2008,1,California,Obesity,Appropriations,Community,Water Supply Planning,LEG,002APP
2011,1,West Virginia,Physical Activity,Physical Education Requirements,School/After School,Secretary of State,REG,036PER
2010,1,Kentucky,Nutrition,Farm Direct Foods,Community,Honor Farmers/Food Checkout Week,LEG,015FDF
2010,1,District of Columbia,Nutrition,Incentives,Restaurant/Retail,Supermarket Tax Abatement,LEG,029INC
2009,1,Minnesota,Physical Activity,Public Transportation,Community,Capital Improvements,LEG,040TRS
2011,1,New Jersey,Physical Activity,Incentives,Work Place,State Health Benefits Program State Employee Wellness,LEG,029INC
2009,1,Connecticut,Obesity,Body Mass Index (BMI),Community,Municipal Revenue Diversification,LEG,006BMI
2009,1,Massachusetts,Obesity,Appropriations,Community,Development of Underused State Owned Real Property,LEG,002APP
2011,1,Tennessee,Physical Activity,Built Environment and Street-Scale Design,Community,Traffic Safety,LEG,049BED
2011,1,Texas,Physical Activity,Pedestrians/Walking,Community,Prosper Municipal Management District No. 2,LEG,052PED
2009,1,New York,Nutrition,Appropriations,School/After School,Childrens Healthy Access to Meals Program,LEG,002APP
2011,1,North Carolina,Nutrition,Appropriations,Early Care and Education,Childhood Obesity Legislative Task Force,LEG,002APP
2011,1,Vermont,Nutrition,Food Assistance Programs,School/After School,Unified Health Systems,LEG,003FAP
2010,1,Georgia,Nutrition,School Nutrition,Restaurant/Retail,Supplemental Appropriations,LEG,043SNU
2010,1,Michigan,Physical Activity,Bicycling,Community,Department of Transportation,LEG,005BIK
2005,1,North Dakota,Obesity,Disparities/Equity,Community,Early Childhood Services,LEG,013DEQ
2010,1,Minnesota,Nutrition,Food Assistance Programs,Community,Human Services,LEG,003FAP
2010,1,Oklahoma,Physical Activity,Bicycling,Restaurant/Retail,Healthy Communities,LEG,005BIK
2014,1,Minnesota,Physical Activity,Public Transportation,Community,Low-income Housing Tax Credits,LEG,040TRS
2009,1,Illinois,Nutrition,Food Assistance Programs,Community,Department pf Human Services Appropriations,LEG,003FAP
2010,1,California,Physical Activity,"Parks, Recreation and Trails",Community,Allocation System: Unified Volume Ceiling,REG,034PRT
2011,1,Hawaii,Physical Activity,Disparities/Equity,Community,State Public Housing Authority,LEG,013DEQ
2011,1,Connecticut,Physical Activity,Physical Education Requirements,School/After School,School District Mandates,LEG,036PER
2013,1,North Dakota,Physical Activity,Bicycling,Community,A Concurrent Resolution,LEG,005BIK
2011,1,District of Columbia,Obesity,Appropriations,Community,Randall School Disposition,LEG,002APP
2014,2,Michigan,Nutrition,Breastfeeding,Community,The General Law Village Act,LEG,007BFD
2009,1,Texas,Nutrition,Access to Healthy Foods,School/After School,Farm to School Coordination Task Force,LEG,001AHF
2005,1,California,Physical Activity,Pedestrians/Walking,Community,Parks: The Great California Delta Trail System,LEG,052PED
2010,1,Ohio,Nutrition,Access to Healthy Foods,Restaurant/Retail,"Women, Infants and Children (WIC) Program",REG,001AHF
2009,1,Minnesota,Physical Activity,Public Transportation,Community,Human Services,LEG,040TRS
2011,1,Virginia,Nutrition,Medical Care,Community,Following Too Closely,LEG,026MEC
2010,1,North Carolina,Physical Activity,Physical Education Requirements,School/After School,Health and Physical Education Classes,LEG,036PER
2010,1,New York,Nutrition,Farm Direct Foods,School/After School,State Environmental Purchasing,LEG,015FDF
2009,1,Connecticut,Obesity,Body Mass Index (BMI),Community,Bonds,LEG,006BMI
2011,1,Hawaii,Nutrition,Healthier Food Retail and Food Deserts,School/After School,Taxation,LEG,021HFR
2011,1,California,Physical Activity,Public Transportation,Community,Subdivisions,LEG,040TRS
2011,1,Arkansas,Nutrition,Access to Healthy Foods,Early Care and Education,Childhood Education Appropriation,LEG,001AHF
2009,1,Georgia,Nutrition,Medical Care,Community,Uniform Rules of the Road,LEG,026MEC
2009,1,Connecticut,Physical Activity,Bicycling,Community,Transit Stations,LEG,005BIK
2005,1,Iowa,Physical Activity,Physical Activity Requirements,School/After School,Healthy Children Task Force,LEG,035PAR
2011,1,Massachusetts,Physical Activity,Built Environment and Street-Scale Design,Community,Protection of Pedestrians At Crosswalks,LEG,049BED
2013,3,Missouri,Obesity,Initiatives and Programs,School/After School,Cade's Law,LEG,053INP
2009,1,Minnesota,Physical Activity,Bicycling,Community,Capital Improvements,LEG,005BIK
2009,1,New York,Physical Activity,Incentives,Community,Sales and Use Tax Exemptions,LEG,029INC
2010,1,Washington,Nutrition,Farmers Markets,Community,Church Property,LEG,016FAM
2012,1,Hawaii,Nutrition,Incentives,Community,An Act Relating to the Establishment of an Agribusiness Cooperative Program<br>,LEG,029INC
2009,1,Ohio,Physical Activity,Task Forces/Councils,School/After School,Nutritional Standards,LEG,047TFC
2011,1,Hawaii,Nutrition,School Nutrition,School/After School,State Property Usage,LEG,043SNU
2009,1,New Hampshire,Obesity,Body Mass Index (BMI),Medical and/or Hospital,Standard Wellness Plan Rate and Form Filing Standards,REG,006BMI
2010,1,Virginia,Nutrition,Farmers Markets,Restaurant/Retail,Private Home Food Preparation,LEG,016FAM
2011,1,Minnesota,Physical Activity,Pedestrians/Walking,Community,Capital Improvements,LEG,052PED
2009,1,Rhode Island,Obesity,Sugar Sweetened Beverages,Community,Taxation,LEG,046SSB
2009,1,Massachusetts,Physical Activity,Safe Routes to Schools,Community,Transportation System Modernization,LEG,041SRS
2011,1,West Virginia,Obesity,Incentives,Restaurant/Retail,Soft Drinks Tax,LEG,029INC
2005,1,California,Physical Activity,Initiatives and Programs,School/After School,Senate Concurrent resolution                 <br>,LEG,053INP
2013,1,California,Obesity,Incentives,Community,Federal and State Low Income Housing Tax Credit Law,REG,029INC
2011,1,Minnesota,Obesity,Appropriations,Community,Transportation,LEG,002APP
2011,1,Massachusetts,Obesity,Food Restrictions,Community,Farmers Markets,LEG,020FOR
2010,1,Vermont,Nutrition,Farm Direct Foods,Community,Competitive Grants,LEG,015FDF
2011,1,Indiana,Obesity,Appropriations,Restaurant/Retail,Local Food and Farm Task Force,LEG,002APP
2010,1,Wisconsin,Obesity,Appropriations,Community,Durand Tax Incremental District 3,LEG,002APP
2009,1,California,Nutrition,School Nutrition,Early Care and Education,Child Care: Nutritional Requirements,LEG,043SNU
2009,1,Alabama,Physical Activity,Appropriations,Community,Debt Service,LEG,002APP
2011,1,Minnesota,Physical Activity,Public Transportation,Community,Capital Improvements,LEG,040TRS
2011,1,California,Physical Activity,Public Safety,Community,Community Development: Promise Neighborhoods Initiative,LEG,039SAF
2011,1,Hawaii,Obesity,Appropriations,Community,Planning,LEG,002APP
2010,1,Rhode Island,Obesity,Task Forces/Councils,Medical and/or Hospital,State Affairs and Government,LEG,047TFC
2010,1,Illinois,Physical Activity,Physical Education Requirements,School/After School,Health Education and School Fitness Testing,LEG,036PER
2009,1,Oregon,Physical Activity,Pedestrians/Walking,Community,Financing for Transportation Projects,LEG,052PED
2010,1,Maryland,Obesity,Front of Package Labeling,School/After School,Board of Education,LEG,024FOP
2011,1,New York,Nutrition,Trans Fats,School/After School,Sale of Certain Foods in Vending Machines,LEG,050FAT
2012,1,Rhode Island,Physical Activity,Disabilities,School/After School,Regulations Governing the Education of Children with Disabilities<br>,REG,011DIS
2009,1,Illinois,Nutrition,Food Assistance Programs,Community,Affordable Health Insurance Act,LEG,003FAP
