Year,Quarter,LocationDesc,HealthTopic,PolicyTopic,Setting,Title,PolicyTypeID,PolicyTopicID
2009,1,California,Nutrition,Access to Healthy Foods,Community,Agriculture: Victory Garden Growers,LEG,001AHF
2011,1,Massachusetts,Obesity,Appropriations,School/After School,Mandatory Physical Education,LEG,002APP
2011,1,New Jersey,Physical Activity,Public Safety,School/After School,Playground Safety Subcode,REG,039SAF
2009,1,Minnesota,Physical Activity,Bicycling,Community,Financing of State and Local Government,LEG,005BIK
2005,1,Pennsylvania,Physical Activity,Appropriations,Community,Capital Budget,LEG,002APP
2009,1,Iowa,Obesity,Menu Labeling,Community,Iowa Jobs Program,REG,032MNL
2009,1,Illinois,Nutrition,Medical Care,Community,Fiscal Year 2010 Appropriations,LEG,026MEC
2010,1,Hawaii,Physical Activity,Built Environment and Street-Scale Design,Community,Department of Transportation,LEG,049BED
2010,1,California,Obesity,Appropriations,Community,Local Government: Community Facilities Districts,LEG,002APP
2008,1,New York,Nutrition,Farm Direct Foods,Community,An Act Making Appropriation<br>,LEG,015FDF
2010,1,Pennsylvania,Physical Activity,Pedestrians/Walking,Community,Private Land and Public Recreation,LEG,052PED
2011,1,Minnesota,Physical Activity,Built Environment and Street-Scale Design,Community,Stadiums,LEG,049BED
2009,1,Arkansas,Nutrition,Appropriations,Community,Social Services Block Grant Pre-Expenditure Report,REG,002APP
2012,1,New York,Nutrition,Fruits and Vegetables,Work Place,Relates to Obesity Prevention<br>,LEG,025FAV
2010,1,New York,Obesity,Menu Labeling,Restaurant/Retail,Chain Restaurants Or Food Service Establishments,LEG,032MNL
2011,1,Massachusetts,Obesity,Food Restrictions,Community,Foods Containing Artificial Trans Fat,LEG,020FOR
2004,1,New York,Nutrition,Appropriations,Community,An Act Making  Appropriations for the Support of  Government<br>,LEG,002APP
2010,1,Iowa,Obesity,Menu Labeling,Community,Ten Smart Planning Principles,LEG,032MNL
2008,1,Maryland,Nutrition,Incentives,School/After School,Physical Education Requirements in Public Schools,LEG,029INC
2011,1,California,Nutrition,Appropriations,Community,Taxation: Sweetened Beverage Tax: Children's Health,LEG,002APP
2011,1,Nevada,Physical Activity,Pedestrians/Walking,Community,Provisions Relating to Redevelopment,LEG,052PED
2011,1,Idaho,Physical Activity,Public Transportation,School/After School,Local Land Use Planning and Production,LEG,040TRS
2012,1,New Jersey,Nutrition,Agriculture and Farming,Community,An Act Concerning Water Supply Protection and Open Space and Farmland Preservation<br>,LEG,017AGF
2009,1,New York,Nutrition,Food Assistance Programs,Medical and/or Hospital,Health and Mental Hygiene Budget,LEG,003FAP
2011,1,California,Obesity,Appropriations,School/After School,Community Development: Promise Neighborhoods Initiative,LEG,002APP
2011,1,New York,Nutrition,Access to Healthy Foods,Community,School Districts Purchase of Food Products,LEG,001AHF
2011,1,New York,Obesity,Initiatives and Programs,School/After School,Public Health Information Campaign,LEG,053INP
2011,1,Massachusetts,Physical Activity,Pedestrians/Walking,Community,Right of Way Violations,LEG,052PED
2014,4,New Jersey,Nutrition,Initiatives and Programs,School/After School,New Jersey School Breakfast Kiosk Pilot Program Fund,LEG,053INP
2011,1,Maryland,Nutrition,Farm Direct Foods,Community,Raw Agricultural Products Sales,LEG,015FDF
2009,1,West Virginia,Physical Activity,Pedestrians/Walking,Community,Patient Centered Medical Homes Pilot Projects,LEG,052PED
2011,1,California,Obesity,Liability and Indemnity,Restaurant/Retail,Local Taxation: Counties: School Districts,LEG,030LAI
2011,1,Vermont,Nutrition,School Nutrition,School/After School,Economic Development,LEG,043SNU
2011,1,Mississippi,Nutrition,Farmers Markets,Community,Farmers Markets,LEG,016FAM
2010,1,Michigan,Nutrition,Agriculture and Farming,Community,Community Health,LEG,017AGF
2009,1,Arkansas,Obesity,Appropriations,Community,Department of Human Services Appropriation,LEG,002APP
2009,1,North Carolina,Physical Activity,Appropriations,Early Care and Education,Healthy Eating and Physical Activity Child Care,LEG,002APP
2011,1,California,Obesity,Initiatives and Programs,Community,An Act Related to Food Banks<br>,LEG,053INP
2011,1,Hawaii,Nutrition,Farm Direct Foods,School/After School,School Gardens,LEG,015FDF
2011,1,Maryland,Obesity,Appropriations,School/After School,School Bus Monitoring Cameras,LEG,002APP
2009,1,New York,Obesity,Appropriations,Community,Community Preservation Funds,LEG,002APP
2011,1,Florida,Nutrition,Access to Healthy Foods,Restaurant/Retail,Public Food Service Establishments,LEG,001AHF
2010,1,New Jersey,Nutrition,Medical Care,Community,Transit Villages Act,LEG,026MEC
2011,1,Missouri,Nutrition,Farm Direct Foods,Community,An Act Relating to Farming,LEG,015FDF
2009,1,Massachusetts,Nutrition,Food Security,Community,School Nutrition,LEG,023FOS
2011,1,Ohio,Nutrition,Healthier Food Retail and Food Deserts,Restaurant/Retail,Underserved Community Grocery Store Tax Credits,LEG,021HFR
2011,1,New York,Obesity,Food Restrictions,School/After School,Sale of Certain Foods in Vending Machines,LEG,020FOR
2011,1,Vermont,Nutrition,Agriculture and Farming,Community,Government Product Purchases,LEG,017AGF
2009,1,Illinois,Nutrition,Trans Fats,Community,Illinois Income Tax Act,LEG,050FAT
2009,1,West Virginia,Physical Activity,Bicycling,School/After School,Patient Centered Medical Homes Pilot Projects,LEG,005BIK
2009,1,New York,Nutrition,Agriculture and Farming,Community,Orchards and Vineyards,LEG,017AGF
2010,1,Mississippi,Nutrition,Liability and Indemnity,Restaurant/Retail,Town of Como,LEG,030LAI
2012,1,Iowa,Nutrition,Fruits and Vegetables,School/After School,An Act Relating to the Iowa Hot Lunch Challenge<br>,LEG,025FAV
2011,1,Iowa,Nutrition,Appropriations,School/After School,Local Foods,LEG,002APP
2010,1,Florida,Obesity,Appropriations,School/After School,Spring Lake Improvement District,LEG,002APP
2011,1,Oregon,Obesity,Food Restrictions,Community,The Oregon Food Policy Council,LEG,020FOR
2003,1,Maine,Obesity,Health Insurance Coverage,Work Place,An Act to Study Obesity and Methods to Reduce the Cost of Health Care and Increase the Public Health<br>,LEG,028HIC
2009,1,Mississippi,Physical Activity,Physical Education Requirements,School/After School,Physical Education,LEG,036PER
2010,1,Arkansas,Obesity,Appropriations,School/After School,Ten-Year Facilities Master Plan Program,REG,002APP
2009,1,New York,Obesity,Body Mass Index (BMI),Community,Smart Growth for the New Century Act,LEG,006BMI
2009,1,Vermont,Nutrition,Farm Direct Foods,School/After School,Farmers Markets,LEG,015FDF
2011,1,Mississippi,Nutrition,Farmers Markets,Community,Healthy Food Retail,LEG,016FAM
2011,1,Minnesota,Nutrition,Appropriations,Community,Agriculture,LEG,002APP
2009,1,Massachusetts,Physical Activity,"Parks, Recreation and Trails",Community,Athol Conservation Land,LEG,034PRT
2009,1,New York,Physical Activity,Public Safety,Community,Empire State Housing Investment Fund Act,LEG,039SAF
2014,3,New York,Nutrition,Vending,School/After School,Establishing Nutrition Standards for Competitive Foods and Beverages,LEG,051VEN
2011,1,Mississippi,Obesity,Appropriations,Community,Sweetened Beverages and Syrups Tax,LEG,002APP
2009,1,Tennessee,Obesity,Appropriations,Community,Department Of Safety,LEG,002APP
2011,1,Delaware,Nutrition,School Nutrition,School/After School,Trans Fats In Schools,LEG,043SNU
2006,1,Indiana,Obesity,Task Forces/Councils,School/After School,Student Nutrition and Physical Activity,LEG,047TFC
2011,1,Rhode Island,Nutrition,Farm Direct Foods,School/After School,Sales and Use Taxes for Vending Machines,LEG,015FDF
2010,1,New Mexico,Nutrition,Healthier Food Retail and Food Deserts,Restaurant/Retail,Taxation and Soft Drinks,LEG,021HFR
2010,1,Minnesota,Nutrition,Nutrition Standards,School/After School,School District Wellness and Nursing Home Rates,LEG,010NUS
2009,1,Kentucky,Obesity,Liability and Indemnity,Community,Healthy Lifestyles,LEG,030LAI
2009,1,Massachusetts,Physical Activity,Bicycling,School/After School,Transportation System Modernization,LEG,005BIK
2011,1,Maryland,Obesity,Appropriations,School/After School,Maryland Combating Childhood Obesity Grant Program,LEG,002APP
2010,1,District of Columbia,Nutrition,Medical Care,Restaurant/Retail,Bellevue Small Area Action Plan,LEG,026MEC
2010,1,Kentucky,Nutrition,Agriculture and Farming,Community,Agriculture,LEG,017AGF
2010,1,Illinois,Nutrition,Farm Direct Foods,Community,Farmers Market Technology Improvement Program,LEG,015FDF
2010,1,New Jersey,Physical Activity,Pedestrians/Walking,Community,Pedestrian Safety,LEG,052PED
2009,1,Missouri,Nutrition,Incentives,Early Care and Education,Workplace Recognition Program,LEG,029INC
2013,1,Texas,Nutrition,Disparities/Equity,Community,An Act Relating to a Nutrition and Wellness Education Program,LEG,013DEQ
2013,1,Maine,Nutrition,School Nutrition,School/After School,An Act To Support School Nutrition and Expand the Local Foods Economy,LEG,043SNU
2010,1,Virginia,Nutrition,Appropriations,Restaurant/Retail,State Grown Food Products,LEG,002APP
2011,1,Colorado,Physical Activity,Bicycling,Restaurant/Retail,Surface Transportation Funding,LEG,005BIK
2011,1,Massachusetts,Nutrition,Appropriations,School/After School,Public School Commercialism,LEG,002APP
2009,1,Missouri,Nutrition,Food Assistance Programs,Community,Meals on Wheels,LEG,003FAP
2011,1,Hawaii,Nutrition,Appropriations,School/After School,School Meals,LEG,002APP
2010,1,Alaska,Obesity,Health Insurance Coverage,Medical and/or Hospital,Insurance,LEG,028HIC
2011,1,District of Columbia,Obesity,Appropriations,Restaurant/Retail,Workplace Wellness,LEG,002APP
2010,1,Virginia,Physical Activity,Bicycling,Community,Following Too Closely,LEG,005BIK
2010,1,Tennessee,Nutrition,Breastfeeding,Community,Health Care,LEG,007BFD
2010,1,Missouri,Nutrition,Liability and Indemnity,School/After School,Department of Revenue Appropriation,LEG,030LAI
2011,1,Maryland,Obesity,Disparities/Equity,Community,Subtraction Modification,LEG,013DEQ
2009,1,Utah,Physical Activity,Built Environment and Street-Scale Design,Community,At-Grade Railroad Crossings,REG,049BED
2008,1,Florida,Nutrition,Liability and Indemnity,Community,Professional Sports Development Trust Fund,LEG,030LAI
2011,1,Tennessee,Obesity,Appropriations,School/After School,Education,LEG,002APP
2010,1,Florida,Nutrition,Appropriations,Community,Prevention of Obesity,LEG,002APP
2011,1,Montana,Nutrition,Food Assistance Programs,Work Place,Incentive Programs to Reward Healthy Choices,LEG,003FAP
2013,1,New York,Nutrition,Trans Fats,School/After School,Trans Fat Elimination Program,LEG,050FAT
2011,1,Hawaii,Obesity,Appropriations,Restaurant/Retail,Consumer Information,LEG,002APP
2010,1,South Carolina,Nutrition,Farm Direct Foods,Community,Richland County,LEG,015FDF
2013,1,New York,Obesity,Food Restrictions,School/After School,Trans Fat Elimination Program,LEG,020FOR
2011,1,Hawaii,Physical Activity,Incentives,School/After School,Taxation,LEG,029INC
2011,1,Texas,Nutrition,Healthier Food Retail and Food Deserts,Restaurant/Retail,Sweetened Beverages Tax,LEG,021HFR
2011,1,New York,Obesity,Sugar Sweetened Beverages,School/After School,Prohibiting the Sale of Certain Foods and Beverages<br>,LEG,046SSB
2007,1,Washington,Obesity,Health Insurance Coverage,Community,Operating Appropriations,LEG,028HIC
2005,1,Illinois,Physical Activity,Pedestrians/Walking,Community,Park Zone Speed Limits,LEG,052PED
2004,1,Colorado,Physical Activity,"Parks, Recreation and Trails",Community,Safe Routes to School,LEG,034PRT
2011,1,New Mexico,Obesity,Appropriations,Community,Bicycle Regulations,LEG,002APP
2011,1,Oklahoma,Nutrition,Incentives,Restaurant/Retail,Revenue And Taxation,LEG,029INC
2011,1,California,Nutrition,Access to Healthy Foods,Community,Taxation: Sweetened Beverage Tax: Children's Health,LEG,001AHF
2011,1,Missouri,Nutrition,Access to Healthy Foods,Community,"Expenses, Grants, Refunds, and Distributions",LEG,001AHF
2011,1,Florida,Nutrition,Food Assistance Programs,Work Place,State Employee Health Insurance Benefits,LEG,003FAP
2014,4,New Jersey,Nutrition,Vending,Restaurant/Retail,Children’s Health Promotion Fund,LEG,051VEN
2005,1,Arizona,Nutrition,School Nutrition,School/After School,School Nutritional Standards,LEG,043SNU
2009,1,Hawaii,Obesity,Health Insurance Coverage,Medical and/or Hospital,Health Insurance and Children,LEG,028HIC
2011,1,New York,Obesity,Health Insurance Coverage,Medical and/or Hospital,Cooperative Agreements for Personnel Services,LEG,028HIC
2010,1,Oklahoma,Nutrition,Medical Care,Community,Healthy Communities,LEG,026MEC
2014,3,New York,Obesity,Front of Package Labeling,Community,Sugar-Sweetened Beverages Safety Warning Act,LEG,024FOP
2011,1,Michigan,Obesity,Body Mass Index (BMI),Community,Public Private Partnerships,LEG,006BMI
2015,1,New York,Nutrition,Task Forces/Councils,Community,Trans fat reduction; Menu Labeling; breastfeeding rights; BMI in schools; PE/PA requirements; Bicycle parking,LEG,047TFC
2010,1,Massachusetts,Nutrition,Farm Direct Foods,Medical and/or Hospital,Fiscal Year 2011 Budget,LEG,015FDF
2010,1,Massachusetts,Nutrition,Appropriations,School/After School,School Nutrition,LEG,002APP
2010,1,New Jersey,Nutrition,Trans Fats,Community,Health and Fitness Club Fees,LEG,050FAT
2011,1,South Dakota,Nutrition,Access to Healthy Foods,Restaurant/Retail,Sales Tax Rates,LEG,001AHF
2002,1,Florida,Physical Activity,Initiatives and Programs,School/After School,An Act Relating to Safe Transportation for Children<br>,LEG,053INP
2009,1,Maine,Obesity,Appropriations,School/After School,Schools and Local Food,LEG,002APP
2009,1,New Mexico,Nutrition,Media Campaigns,School/After School,Public School Facilities,LEG,031MDC
2014,1,Hawaii,Physical Activity,Pedestrians/Walking,Community,Transit-Oriented Development Advisory Committee,LEG,052PED
2011,1,New York,Nutrition,Trans Fats,Community,Sales and Compensating Use Tax Exemption,LEG,050FAT
2011,1,Hawaii,Nutrition,Appropriations,School/After School,Department of Education,LEG,002APP
2011,1,Hawaii,Nutrition,Appropriations,Restaurant/Retail,"Kalo, Taro Farms, School Meals",LEG,002APP
2009,1,Pennsylvania,Nutrition,Farmers Markets,Community,Supplemental Appropriation,LEG,016FAM
2002,1,Florida,Physical Activity,Safe Routes to Schools,Community,An Act Relating to Safe Transportation for Children<br>,LEG,041SRS
2002,1,Virginia,Physical Activity,"Parks, Recreation and Trails",Community,Paradise Creek,LEG,034PRT
2009,1,Massachusetts,Nutrition,Incentives,School/After School,Student Nutrition and Wellness,LEG,029INC
2011,1,California,Nutrition,Appropriations,School/After School,Taxation: Sweetened Beverage Tax: Children's Health,LEG,002APP
2011,1,Massachusetts,Physical Activity,Bicycling,Community,Moving Vehicle Law Bicycle Inclusion,LEG,005BIK
2011,1,Nevada,Physical Activity,Bicycling,Community,Military Installations,LEG,005BIK
2010,1,Alabama,Obesity,Food Restrictions,Community,Farmers Market,LEG,020FOR
2009,1,New York,Physical Activity,Built Environment and Street-Scale Design,Community,Pedestrian Safety Enhancement Act,LEG,049BED
2011,1,California,Nutrition,Appropriations,Restaurant/Retail,Retail Food Facilities: Toys and Incentives,LEG,002APP
2011,1,New York,Obesity,Food Restrictions,Restaurant/Retail,Local Produce Tax Credit,LEG,020FOR
2010,1,Georgia,Nutrition,Appropriations,Restaurant/Retail,Supplemental Appropriations,LEG,002APP
2013,1,Texas,Obesity,Food Restrictions,Community,An Act Relating to Prohibiting the Purchase of Energy Drinks,LEG,020FOR
2009,1,Alaska,Physical Activity,Appropriations,School/After School,Budget Funds,LEG,002APP
2011,1,Nevada,Nutrition,Trans Fats,School/After School,Trans Fats at Public Schools,LEG,050FAT
2012,1,New York,Nutrition,Fruits and Vegetables,Community,An Act in Relation to Combating Incidences of Adult and Childhood Obesity<br>,LEG,025FAV
2010,1,Hawaii,Nutrition,Agriculture and Farming,School/After School,Farm to School Pilot Program,LEG,017AGF
2009,1,Minnesota,Obesity,Food Restrictions,Restaurant/Retail,Human Services,LEG,020FOR
2011,1,Hawaii,Physical Activity,Pedestrians/Walking,Work Place,Tax Credits,LEG,052PED
2015,1,New York,Nutrition,Sodium,Community,Trans fat reduction; breastfeeding rights; BMI in schools; PE/PA requirements; Bicycle parking,LEG,045SOD
2010,1,California,Nutrition,Agriculture and Farming,Community,Public Health: Food Justice,LEG,017AGF
2011,1,Kentucky,Physical Activity,Appropriations,Community,Budget Bill Amendments,LEG,002APP
2009,1,Oregon,Nutrition,Medical Care,Community,Financing for Transportation Projects,LEG,026MEC
2011,1,Hawaii,Physical Activity,Public Safety,School/After School,Homeless Assistance,LEG,039SAF
2010,1,New York,Obesity,Food Restrictions,Restaurant/Retail,Greenmarket Definition,LEG,020FOR
2010,1,Pennsylvania,Nutrition,Farm Direct Foods,School/After School,School Foods Reform,LEG,015FDF
2010,1,Connecticut,Nutrition,School Nutrition,Community,"Farms, Food and Jobs",LEG,043SNU
2011,1,Tennessee,Physical Activity,"Parks, Recreation and Trails",Community,Industrial Development,LEG,034PRT
2003,1,New York,Nutrition,Access to Healthy Foods,Community,An Act Making Appropriations,LEG,001AHF
2011,1,Wisconsin,Physical Activity,Physical Activity Requirements,Work Place,An Act Relating to Income and Franchise Tax Credit for Workplace Wellness Programs<br><br>,LEG,035PAR
2010,1,Maryland,Obesity,Appropriations,Community,State Highway Administration,LEG,002APP
2013,3,North Carolina,Obesity,Liability and Indemnity,Restaurant/Retail,Commonsense Consumption Act,LEG,030LAI
2010,1,Vermont,Obesity,Liability and Indemnity,Community,Health Care Coverage,LEG,030LAI
2011,1,New York,Obesity,Appropriations,School/After School,Tax Increment Bonds Payable From Real Property Taxes Le,LEG,002APP
2009,1,Massachusetts,Nutrition,Appropriations,School/After School,Healthy Alternatives in Public School Food Program,LEG,002APP
2011,1,Tennessee,Obesity,Appropriations,Community,Taxes,LEG,002APP
2009,1,North Dakota,Obesity,Appropriations,Community,Sustainable Agriculture,LEG,002APP
2011,1,Oklahoma,Nutrition,Vending,Community,Healthier Neighborhood Living Task Force,LEG,051VEN
2011,1,Arkansas,Nutrition,Food Policy Councils,Restaurant/Retail,State Economic Development,LEG,022FPC
2011,1,Florida,Physical Activity,Disparities/Equity,Community,Affordable Housing Provisions,LEG,013DEQ
2009,1,New York,Obesity,Appropriations,School/After School,Physical Education Improvement,LEG,002APP
2011,1,Hawaii,Obesity,Health Insurance Coverage,Community,Medicaid Wellness Pilot Program,LEG,028HIC
2010,1,New Hampshire,Nutrition,Appropriations,Medical and/or Hospital,Nursing Home Rules,REG,002APP
2005,1,North Dakota,Nutrition,Agriculture and Farming,Medical and/or Hospital,Expenses Of The Department Of Health,LEG,017AGF
2010,1,Wisconsin,Nutrition,Agriculture and Farming,Restaurant/Retail,Food Processing Plants,REG,017AGF
2009,1,New Mexico,Nutrition,Appropriations,Community,Healthy Appropriate Foods,LEG,002APP
2011,1,Montana,Nutrition,Food Policy Councils,Community,Study on Reducing Childhood Hunger,LEG,022FPC
2001,1,Texas,Nutrition,School Nutrition,School/After School,Foods And Beverages For Schools Use,LEG,043SNU
2008,1,Louisiana,Nutrition,Disparities/Equity,Community,Senate Resolution,LEG,013DEQ
2011,1,Idaho,Nutrition,Incentives,Community,Food Tax Credits,LEG,029INC
2002,1,Colorado,Nutrition,Appropriations,Community,Distribution of Food Coupons to Women,LEG,002APP
2009,1,Florida,Obesity,Appropriations,Community,Statewide Legacy Communities Initiative,LEG,002APP
2011,1,Missouri,Nutrition,Food Assistance Programs,Community,Missouri Sustainable Local Food Policy Council,LEG,003FAP
2011,1,Arkansas,Nutrition,Farm Direct Foods,Community,Farmers Market Regulation,LEG,015FDF
2009,1,Massachusetts,Obesity,Appropriations,School/After School,Appropriations,LEG,002APP
2012,1,Texas,Physical Activity,Physical Education Requirements,School/After School,"Graduation Requirements, Beginning with School Year 2012-2013",REG,036PER
2011,1,Hawaii,Nutrition,Food Assistance Programs,Community,Appropriation for the Women and Infant Children Farmers,LEG,003FAP
2002,1,Virginia,Obesity,Appropriations,Community,Failure to Yield to Pedestrians,LEG,002APP
2009,1,Tennessee,Nutrition,Farm Direct Foods,Community,Food and Food Products,LEG,015FDF
2011,1,Hawaii,Obesity,Incentives,Medical and/or Hospital,Tax Credits,LEG,029INC
2010,1,Mississippi,Nutrition,Appropriations,Community,Healthcare Coordinating Council,LEG,002APP
2012,1,New York,Physical Activity,Physical Activity Requirements,Community,Relates to Obesity Prevention<br>,LEG,035PAR
2011,1,Maryland,Nutrition,Task Forces/Councils,Community,Organic and Locally Grown Agricultural Products,LEG,047TFC
2010,1,Utah,Obesity,Body Mass Index (BMI),Community,Public School Funding,LEG,006BMI
2009,1,Montana,Nutrition,Farmers Markets,Community,Farmers Market Laws,LEG,016FAM
2011,1,Massachusetts,Nutrition,Incentives,Community,Reducing Childhood Obesity Rates,LEG,029INC
2009,1,New York,Nutrition,Agriculture and Farming,Restaurant/Retail,Wholesale Regional Farmers Markets,LEG,017AGF
2009,1,Massachusetts,Physical Activity,Public Transportation,School/After School,Transportation System Modernization,LEG,040TRS
2011,1,Arkansas,Obesity,Appropriations,School/After School,Education Appropriation,LEG,002APP
2005,1,Maryland,Obesity,Task Forces/Councils,Medical and/or Hospital,Treatment of Morbid Obesity,LEG,047TFC
2011,1,South Carolina,Nutrition,Appropriations,Medical and/or Hospital,Insurance Trade Practices,LEG,002APP
2009,1,Maryland,Obesity,Incentives,Work Place,State Employee and Retiree Benefits,LEG,029INC
2014,1,Hawaii,Nutrition,Task Forces/Councils,Community,Farm-to-Table Task Force,LEG,047TFC
2009,1,Mississippi,Obesity,Appropriations,Community,Major Economic Impact Act,LEG,002APP
2012,1,Minnesota,Nutrition,Fruits and Vegetables,Community,An Act Relating to Public Safety,LEG,025FAV
2009,1,Massachusetts,Nutrition,Farmers Markets,Community,Governor Fiscal Year 2010 Budget,LEG,016FAM
2011,1,Nevada,Obesity,Body Mass Index (BMI),School/After School,Redevelopment Agencies,LEG,006BMI
2007,1,Washington,Nutrition,Food Assistance Programs,Community,Operating Appropriations,LEG,003FAP
2011,1,Washington,Nutrition,Sodium,Community,An Act Relating to the Establishment of Food Purchasing Policies<br>,LEG,045SOD
2010,1,Vermont,Nutrition,Incentives,Restaurant/Retail,Soft Drinks,LEG,029INC
2011,1,District of Columbia,Obesity,Appropriations,Community,Pedestrian Safety Reinforcement,LEG,002APP
2011,1,Texas,Physical Activity,Safe Routes to Schools,School/After School,Sweetened Beverages Tax,LEG,041SRS
2009,1,Maine,Obesity,Food Restrictions,School/After School,Schools and Local Food,LEG,020FOR
2009,1,Minnesota,Physical Activity,Pedestrians/Walking,Community,Financing of State and Local Government,LEG,052PED
2010,1,Missouri,Physical Activity,Built Environment and Street-Scale Design,Community,Motor Vehicle Drivers,LEG,049BED
2012,1,Rhode Island,Nutrition,Media Campaigns,Community,The  Rhode Island Local Agriculture and Seafood Act<br>,LEG,031MDC
2011,1,Arkansas,Physical Activity,Appropriations,Early Care and Education,Appropriation to the Department of Human Services,LEG,002APP
2009,1,Illinois,Physical Activity,Physical Education Requirements,School/After School,School Code,LEG,036PER
2010,1,Vermont,Obesity,Sugar Sweetened Beverages,Medical and/or Hospital,Health Care Coverage,LEG,046SSB
2011,1,Alabama,Nutrition,Appropriations,Restaurant/Retail,Nutrition Labeling of Food,LEG,002APP
2010,1,Pennsylvania,Obesity,Food Restrictions,School/After School,Appropriation Bill,LEG,020FOR
2009,1,Tennessee,Obesity,Incentives,Community,Food and Food Products,LEG,029INC
2009,1,West Virginia,Nutrition,Medical Care,Community,State Roads,LEG,026MEC
2009,1,Hawaii,Nutrition,School Nutrition,School/After School,School Lunches and Local Produce,LEG,043SNU
2011,1,South Carolina,Nutrition,Appropriations,School/After School,School Served Locally Grown Food,LEG,002APP
2009,1,Texas,Nutrition,Task Forces/Councils,Community,Healthy Foods Availability,LEG,047TFC
2009,1,New Jersey,Nutrition,Appropriations,Medical and/or Hospital,Pediatric Medical Day Care Facilities,REG,002APP
2013,1,Georgia,Physical Activity,"Parks, Recreation and Trails",Community,United Against Childhood Obesity Day at the Capitol,LEG,034PRT
2011,1,New York,Nutrition,Appropriations,Community,Senior Benefits Card Program,LEG,002APP
2011,1,Mississippi,Nutrition,Appropriations,Community,Food Reduced Sales Taxes,LEG,002APP
2009,1,Massachusetts,Physical Activity,Safe Routes to Schools,School/After School,Transportation System Modernization,LEG,041SRS
2011,1,Idaho,Obesity,Menu Labeling,Community,Urban Renewal,LEG,032MNL
2011,1,Maine,Nutrition,Farm Direct Foods,Community,Natural Resources and General Fund,LEG,015FDF
2009,1,Michigan,Obesity,Appropriations,Community,Bicycle Safety,LEG,002APP
2006,1,Florida,Nutrition,Task Forces/Councils,School/After School,Healthy Lifestyles,LEG,047TFC
2011,1,Michigan,Nutrition,Agriculture and Farming,Community,Omnibus Budget,LEG,017AGF
2011,1,Missouri,Nutrition,Fruits and Vegetables,Restaurant/Retail,Specified Farm Products Tax and Use Exemption,LEG,025FAV
2009,1,Iowa,Nutrition,School Nutrition,School/After School,School Breakfast and Lunch Program,REG,043SNU
2009,1,New York,Obesity,Sugar Sweetened Beverages,School/After School,New York State Healthy Kids Act,LEG,046SSB
2007,1,Colorado,Obesity,Appropriations,School/After School,Start Smart Nutrition Program,LEG,002APP
2016,4,Illinois,Physical Activity,Task Forces/Councils,School/After School,"Public Schools Evaluation, Recognition and Supervision - Additional Criteria for Physical Education",REG,047TFC
2010,1,Wisconsin,Nutrition,Appropriations,Restaurant/Retail,Food Processing Plants,REG,002APP
2011,1,Rhode Island,Nutrition,Appropriations,Community,State Affairs and Government,LEG,002APP
